Card Name;Cost;Type;Effect / Reminder Text;Power;Durability
Ada's Rally Cry;;Command;Attach this Command to a Pilot you control. Play with the top card of your deck revealed. If it's a Mecha, you may play it.;;
Ada, The Ingenious;;Pilot;A Mecha piloted by Ada, The Ingenious can't be targeted by your opponents.;+0;+2
Admiral Grace;;Pilot;Piloted Mechas you control gain +1 power.;+0;+0
Attack Orders;;Command;One target Mecha you control can attack an extra time this turn.;;
Balloon Army;;Command;When a Mecha you control is attacked, before damage, you may return it to your hand. If you do, place this Command on that Mecha's space as the new target of the attack. While this Command is on the battlefield, it becomes a 0/1 Mecha with a cost of 0.;;
Bear's Rally Cry;;Command;Return up to two Pilots with different names from your graveyard to your hand.;;
Bear, The Unbreakable;;Pilot;When a Mecha piloted by Bear, The Unbreakable is destroyed, return that Mecha to your hand.;+0;+2
Bomber;2;Mecha;Flight (This unit can't be attacked except by units with Flight or Reach). This Mecha can't attack units with Flight.;3;2
Bot-a-pult;2;Mecha;Reach (This unit may attack units with Flight). Sacrifice an adjacent Mecha you control: this Mecha gains Range 3 this turn (This unit may attack any target within three spaces this turn).;2;2
Bugzapper;2;Mecha;Haste (this Mecha can move and attack the same turn it's played). Reach (This unit may attack units with Flight).;3;1
Camouflage;;Command;Attach this Command to one target Mecha you control in your entry zone, then choose a name of a Mecha on the battlefield. The target Mecha's name becomes the name of your choice as long as this Command is attached.;;
Chinashop Bull;2;Mecha;Haste (this Mecha can move and attack the same turn it's played). Armour 1 (This unit enters the battlefield with one Armour counter. If it would take damage while it has any Armour counters, prevent that damage and remove an Armour counter). This Mecha must move and attack each turn. If it can't, destroy it.;3;3
Construction Crew;5;Mecha;When this Mecha enters the battlefield, search your deck for two Towers and put them into your hand. Then shuffle your deck.;3;3
Cruise Missle;1;Mecha;Haste (this Mecha can move and attack the same turn it's played). Pierce (This unit ignores Armour counters when attacking). After this Mecha attacks, destroy it.;6;1
Demolisher;3;Mecha;This Mecha may attack units you control. This Mecha can't attack your opponents. When this Mecha destroys a unit, it gains 1 durability. This Mecha's power is equal to it's durability.;0;2
Dig For Answers;;Singleton Command;Draw three cards, then put two cards from your hand on top of your library.;;
Donna's Rally Cry;;Command;Attach this Command to a Pilot you control. All Pilots you control gain "The piloted Mecha gains +2 power".;;
Donna, The Swift;;Pilot;A Mecha piloted by Donna, The Swift has Speed 2.;+1;+0
Dragon Ship;4;Mecha;Armour 2 (This unit enters the battlefield with two Armour counters. If it would take damage while it has any Armour counters, prevent that damage and remove an Armour counter). This Mecha may not attack and move in the same turn.;4;4
Drill Mole;2;Mecha;This Mecha can't be attacked by units that cost more than 2.;3;2
Drone Nest;;Tower;Provides 1u (1 unit of bandwidth. Play only one Tower card each turn). When this Tower takes damage, you may search your deck for a Mecha with the word "Drone" in it's name and play it in your entry zone. If you do, shuffle your deck. Mechas you control with the word "Drone" in their name gain +1 power.;;2
Drone Swarm;3;Mecha;This Mecha's power is equal to the number of Mechas you control with the word "Drone" in their names.;0;1
Electric Bull;2;Mecha;Other Mechas with the word "Bull" in their names have +1 power.;1;1
EMP Blast;;Command;Destroy all Towers (including Mecha Towers).;;
Engineered Earthquake;;Command;Deal 2 damage to all Mechas without Flight.;;
Espionage;;Command;Look at one target player's hand, then draw a card.;;
Frequency Modulator;2;Mecha;This Mecha's power is equal to your remaining bandwidth.;0;3
Gambit;;Command;Each player discards a card, then draws a card.;;
Gamble;;Command;Each player discards a card from their hand. Then, choose a player at random. That player draws a card for each card discarded this turn.;;
Ghost;2;Mecha;Flight (This unit can't be attacked except by units with Flight or Reach). If you have no cards in your hand, this Mecha gains +4  power.;0;1
Grace's Rally Cry;;Command;Search your deck for two Pilots with different names and put them into your hand. Then, shuffle your deck.;;
Guard Dog;2;Mecha;Haste (this Mecha can move and attack the same turn it's played). Speed 2 (this Mecha may move up to two spaces each turn).;1;1
Gutshot;2;Mecha;When a player plays a Command, they must sacrifice one Tower they control.;2;2
Heavy Fire;;Trigger Command;Remove all Armour counters from one target unit.;;
Hidden Cache;;Command;This Command can't be played. If you discard this Command, draw three cards.;;
Illegal Bullet;;Command;Discard another card from your hand. If you do, one target Mecha you control gains Pierce this turn.;;
Infighting;;Command;Choose two target Pilots an opponent controls. That player sacrifices one Mecha they're attached to.;;
Insect Drone;2;Mecha;Flight (This unit can't be attacked except by units with Flight or Reach).;1;1
Interdiction;;Command;Cancel one target card. (When a player tries to play a card, you may immediately play this Command to prevent and discard it.);;
Ironhide;;Command;Put two Armour counters on one target Mecha you control in your entry zone (If a unit would take damage while it has any Armour counters, prevent that damage and remove an Armour counter).;;
Jaeger;6;Singleton Mecha;Armour 3 (This unit enters the battlefield with three Armour counters. If it would take damage while it has any Armour counters, prevent that damage and remove an Armour counter). Reach (This unit may attack units with Flight).;6;6
Jason's Rally Cry;;Command;Attach this Command to a Pilot you don't control. That Pilot loses all abilities (including changes to cost and power).;;
Jason "The Looks" Brannan;;Pilot;All players play with their hands revealed.;+1;-1
Laser Cannon;4;Mecha;Armour 1 (This unit enters the battlefield with one Armour counter. If it would take damage while it has any Armour counters, prevent that damage and remove an Armour counter). Range 3 (This unit may attack any target within three spaces). This Mecha may not attack and move in the same turn.;2;2
Longshot;;Singleton Command;Return two Commands from your graveyard to your hand.;;
Magpie Drone;3;Mecha;Flight (This unit can't be attacked except by units with Flight or Reach). When this Mecha attacks, the target must move next turn if possible.;1;1
Marching Orders;;Command;One target Mecha you control can move an extra space this turn.;;
Mod Bot;2;Mecha;Sacrifice an adjacent Mecha you control: add that unit's durability to this Mecha.;1;2
Nuclear Blast;;Singleton Command;Destroy all units (Mechas and Towers). Each player discards their hand. Put the top 5 cards of your deck into your graveyard.;;
Orbital Strike;;Trigger Command;Deal 2 damage to one target unit ("units" include Mechas and Towers).;;
Orbiter;1;Mecha;Flight (This unit can't be attacked except by units with Flight or Reach). This Mecha can only attack units with Flight.;1;2
Pack Cat;1;Mecha;This Mecha gains +1 power for each other Mecha you control with the word "Pack" in it's name.;1;1
Pack Dog;3;Mecha;This Mecha gains +1 power for each other Mecha you control with the word "Pack" in it's name.;1;3
Pack Wolf;5;Mecha;This Mecha gains +1 power for each other Mecha you control with the word "Pack" in it's name.;1;5
Potshot;2;Mecha;When a Tower you control is destroyed, deal 1 damage to one target unit an opponent controls.;2;3
Preparations;;Command;One target Mecha you control gains haste this turn (that Mecha can move and attack as normal if you played it this turn).;;
Preplanning;;Command;Search you deck for 3 Towers, and place them on the battlefield. You can't play Towers for the rest of the game.;;
Radioless Carrier;0;Mecha;Flight (This unit can't be attacked except by units with Flight or Reach). Speed 2 (This Mecha may move up to two spaces each turn). This Mecha can't move or attack and loses Flight unless it's piloted.;2;2
Radio Relay;0;Mecha Tower;Play this Mecha Tower on any space with a Radio Tower you control, then sacrifice that Radio Tower. Provides 1u for each unit you control named "Radio Relay" (1 unit of bandwidth. Play only one Tower card each turn).;0;2
Radio Tower;;Basic Tower;Provides 1u (1 unit of bandwidth. Play only one Tower card each turn).;;2
Raining Cats And Dogs;;Command;Search you deck for a card with the word "Cat" in it's name. Then, search your deck for a card with the word "Dog" in it's name. Put those cards into your hand, then shuffle your deck.;;
Rampart;0;Mecha Tower;Provides 1u (1 unit of bandwidth. Play only one Tower card each turn). This Mecha Tower can't move. Adjacent Mechas you control can't be targeted by attacks.;0;2
Ramp Orders;;Command;One target Mecha you control gains Reach this turn (That unit may attack units with Flight).;;
Reconnaissance;;Command;Discard another card from your hand. If you do, one target Mecha you control gains Range 3 this turn.;;
Rigged to Blow;;Command;Attach this Command to one target Mecha you control in your entry zone. When that unit is destroyed, deal 2 damage to the Mecha that attacked it.;;
Rocket Propulsion;;Command;Discard another card from your hand. If you do, one target Mecha you control gains Flight this turn.;;
Sabotage;;Command;Sacrifice a Tower you control. Destroy one target Mecha.;;
Scrapyard Salvage;;Command;Return up to two target Mechas from your graveyard to your hand.;;
Signal Blocker;3;Mecha;Flight (This unit can't be attacked except by units with Flight or Reach). The cost of adjacent Mechas is increased by 3.;1;1
Signal Booster;2;Mecha;Flight (This unit can't be attacked except by units with Flight or Reach). The cost of adjacent Mechas is decreased by 1 (a bandwidth cost can't be less than 0).;1;1
Skipper;2;Mecha;Haste (this Mecha can move and attack the same turn it's played).;2;2
Sky Whale;6;Singleton Mecha;Flight (This unit can't be attacked except by units with Flight or Reach). Armour 2 (This unit enters the battlefield with two Armour counters. If it would take damage while it has any Armour counters, prevent that damage and remove an Armour counter).;4;4
Mechanical Bull;2;Mecha;When this Mecha enters the battlefield, other Mechas with the word "Bull" in their names gain +1 durability.;1;1
Snapshot;;Command;Return two Towers from your graveyard to the battlefield under your control.;;
Sore Tooth;;Trigger Command;If this Command triggers, discard your hand. Otherwise, target opponent discards their hand.;;
Space Lion;;Trigger Command;Return one target Mecha to it's owner's hand.;;
Spectre;2;Mecha;This Mecha's power and durability are reduced by the number of cards in your hand.;5;5
Stonewall;1;Mecha;This Mecha can't attack. When this Mecha moves, it can't move next turn.;0;6
The Vise;3;Mecha;As long as this unit is in play, each player's maximum hand size is reduced by 2.;4;4
Thunder Bull;4;Mecha;This Mecha may attack twice per turn.;2;2
Timely Backup;3;Mecha;When this Mecha enters the battlefield, discard two cards. If you discard less than two cards this way, this Mecha gains 2 Armour counters.;3;2
Tunnel Warfare;;Command;Discard another card from your hand. If you do, one target Mecha you control can move an extra space this turn.;;
Turret;0;Mecha Tower;Provides 1u (1 unit of bandwidth. Play only one Tower card each turn). This Mecha Tower can't move.;4;2
Turtle;2;Mecha;Armour 1 (This unit enters the battlefield with one Armour counter. If it would take damage while it has any Armour counters, prevent that damage and remove an Armour counter). This Mecha may not attack and move in the same turn.;2;3
Unemployment;;Command;Destroy one target Pilot.;;
Virus;;Command;Sacrifice a Tower you control. If you do, one target Mecha an opponent controls can't attack this turn.;;
Wasp Drone;3;Mecha;Flight (This unit can't be attacked except by units with Flight or Reach). When this Mecha attacks, the target can't attack next turn.;1;1
Weapons Cache;;Trigger Command;Draw two cards.;;
Wind-Up Bull;3;Mecha;(No abilities.);4;4
Wind-Up Cat;1;Mecha;(No abilities.);2;2
Wind-Up Dog;2;Mecha;(No abilities.);3;3
Wind-Up Mouse;0;Mecha;(No abilities.);1;1
Wind-Up Spider;4;Mecha;(No abilities.);5;5
Acid Rain;;Command;Destroy one target Command on the battlefield.;;
Grand Hurricane;;Command;Mechas can't move this turn.;;
Anti-Mecha Battery;1;Mecha;Sacrifice this Mecha: Cancel one target Mecha. (When a player tries to plays a Mecha, you may immediately sacrifice this Mecha to prevent and discard it.);0;4
Floodlights;;Tower;Provides 1u (1 unit of bandwidth. Play only one Tower card each turn). Adjacent Mechas  you control gain Pierce (Those units ignore Armour counters when attacking).;;2
Clocktower;;Tower;All Non-Basic Towers lose all abilities, except this ability (Non-Basic towers no longer provide bandwidth).;;5
Urban Ruins;;Command;Play this Command on the battlefield. At the beginning of each player's turn, Mechas that player controls that are on or adjacent to this Command gain 1 durability counter.;;
Siege Tower;;Tower;Provides 3u (3 units of bandwidth. Play only one Tower card each turn). Play this Tower only in an opponent's entry zone (it must still be played next to a Tower you control).;;2
